{
  "schema_version": 1,
  "task_kind": "partition",
  "source": {
    "workspace": "example_org_example_repo_v1_v2",
    "milestone_id": "M100",
    "input_hash": "aaaaaaaaaaaaaaaaaaaaaaaaaaaaaaaaaaaaaaaaaaaaaaaaaaaaaaaaaaaaaaaa"
  },
  "status": "partitioned",
  "subtasks": [
    {
      "id": "M100.sub-01",
      "title": "Add the alpha data model and API",
      "problem_statement": "Provide the alpha data model and its public API.",
      "acceptance_criteria": ["Alpha data can be created and queried through the public API."],
      "depends_on": [],
      "change_unit_ids": ["u-001", "u-002"],
      "source_loc": 300,
      "tests": {
        "f2p": ["tests::alpha"],
        "n2p": [],
        "p2p": ["tests::regression"]
      },
      "evidence": [
        {"kind": "patch", "reference": "u-001,u-002", "detail": "Both units implement the alpha API."}
      ]
    },
    {
      "id": "M100.sub-02",
      "title": "Integrate beta processing",
      "problem_statement": "Process alpha values through the beta integration.",
      "acceptance_criteria": ["Beta processing accepts values produced by the alpha API."],
      "depends_on": ["M100.sub-01"],
      "change_unit_ids": ["u-003"],
      "source_loc": 120,
      "tests": {
        "f2p": [],
        "n2p": ["tests::new_beta"],
        "p2p": ["tests::alpha"]
      },
      "evidence": [
        {"kind": "patch", "reference": "u-003", "detail": "This unit contains the beta integration."}
      ]
    }
  ],
  "test_adjustments": [
    {
      "action": "remove",
      "test_id": "tests::obsolete",
      "rationale": "The test covers an unrelated legacy command.",
      "evidence": [
        {"kind": "test_source", "reference": "tests/legacy.py", "detail": "The test imports no touched component."}
      ]
    },
    {
      "action": "add",
      "test_id": "tests::new_beta",
      "role": "n2p",
      "applies_to": ["M100.sub-02"],
      "rationale": "The beta integration otherwise has no direct target test.",
      "evidence": [
        {"kind": "following_commit", "reference": "bbbbbbb:tests/test_beta.py", "detail": "A focused beta test exists in the following node."}
      ],
      "provenance": {
        "kind": "following_commit",
        "commit": "bbbbbbb",
        "path": "tests/test_beta.py",
        "test_name": "test_new_beta",
        "behavior": "Verifies that beta processing accepts an alpha value."
      }
    },
    {
      "action": "reclassify",
      "test_id": "tests::alpha",
      "from_role": "f2p",
      "to_role": "p2p",
      "rationale": "After the alpha subtask it becomes a regression test for beta integration.",
      "evidence": [
        {"kind": "stage", "reference": "M100.sub-02", "detail": "Alpha behavior is established by the dependency."}
      ]
    }
  ],
  "notes": []
}
